{
  "$schema": "../../schemas/manifest.schema.json",
  "version": "1.0",
  "release_version": "1.1.21",
  "description": "Release v1.1.21: Eliminate Polars from Bronze write/read path (BUG-004 OOM fix)",
  "changes": [
    {
      "type": "container",
      "target": "air-quality-app",
      "action": "build"
    },
    {
      "type": "container",
      "target": "air-quality-app",
      "action": "restart"
    }
  ]
}
