{
  "$schema": "../../schemas/manifest.schema.json",
  "version": "1.0",
  "release_version": "1.1.25",
  "description": "Release v1.1.25: BUG-004 — WAL-only Bronze, eliminate accumulator memory leak",
  "changes": [
    {"type": "container", "target": "air-quality-app", "action": "build"},
    {"type": "container", "target": "air-quality-app", "action": "restart"}
  ]
}
